9.0~One of my faves samibeth Sign in Permalink I normally do not write reviews... and since it is now finals week for me I would count this as good. I remember seeing previews for The 100 here and there and wanted to watch it from them... but sadly since I do not have cable I could not and soon forgot about it. Then I noticed the first season on Netflix and it hooked me within the first episode. The characters are so unique in personality. There are some you love... some you hate then soon they flip flop! I am a big fan of how dark it is, because though it pushes the boundaries it does not break them. Just like a lot of other shows on The CW. Two of my other favorites being The Vampire Diaries and The Originals. I like how The 100 has a different view on the world and how it keeps you guessing through the episodes and seasons. You think one thing will happen and sometimes it does, but sometimes you are hit with a big turn around. Alright, though I could type more I am going to leave it at that.
1.0~Poor man's The Walking Dead! iegarry Sign in Permalink Innumerable plot holes, average acting, contrived at times, none of the leads that you get attached too. All in all an over rated series.
10.0~Definitely the best sci-fi show i have ever seen. And i have seen many. lukegllr Sign in Permalink This show has it all. Great characters, full of development, really impressive acting and writing (which only continues to get better with every season. In season 5 it is some of the best writing, specially acting on TV right now.), creative, exciting and unique storylines, and every one is different than the previous one. If you watch the 100, you definitely wont be bored. If you aren't watching the show, I recommend you go do that right now, and believe me, you wont regret it! It's a shame its as underrated as it is. And dont let the fact that its from the cw trick you... it is unlike any other show out there. No teen drama. There's a lot of action, great effects and awesome fight scenes. And so much more. IMPORTANT: Do not judge it on the first episode, I swear that it gets so, so much better. It really starts to come together on episode 3 or 4
2.0~Mass murderers emilianofuksas Sign in Permalink The body count starts with sending 100 kids to a presumed poisoned Earth, only to discover the planet is actually safe, OK, no killing there but the intention was clear. After a quick 'Lord of the Flies' prelude and a few occasional murders, executions and tortures, the gang lead by Clarke manage to kill about 400 'grounders'. A few more hundreds (or thousands) die in the crash of the landing ships. A brutal execution of unarmed grounders kills about 20. After discovering that the president of the 'not savage'(?) grounders intends to drop a missile on a camp hosting a meeting of the now allied 'sky-people' and 'grounders' tribes, nobody says anything and let thousands die - nice! The retribution comes soon after, a tricked and determined Clarke manages to sneak inside the Mount Weather compound where the remainder of the 'before the apocalypse' people live and ruthlessly SHE KILLS THEM ALL! So, basically in about 4-5 weeks they manage to kill what one can assume it's about half of the population of the area where the 100 kids landed. Not bad at all!
4.0~Good idea but this is the end of the "good" in this TV show dan_conde1982 Sign in Permalink The idea is not new , but is a nice idea for a SF TV Show. The story seems promising at the beginning but over the seasons nothing is changed in the plot. The same characters who just fight theoretically for salvation of the human race but they just kill itch other, over and over . They are all bad, you can't like no one in this TV shows. The leading characters are painted just like serial killers and nothing more ... good idea but a very lame TV show. The true is I was watching this show just to see when they killed the not so sexy and not so talented main character ðŸ˜‚ P.S. don't waste your time with this Show!!! ;)
1.0~bad acting, bad ploting flacaanonima Sign in Permalink Just that. I give this series almost half first season. There was no way that i consider this crap somewhat plausible to watch. The acting is deprorable, the plot is wasted. This can only be liked by teenagers that doesn't have any experience in good acting and good plot....
3.0~I never saw such a foolish story line TV show. ssohan-31689 Sign in Permalink First of all, every leader is a girl even wilder's leader. is it joke?
10.0~Surprise Great show Found by Accident sf_nicole Sign in Permalink So I am going through shows on Netflix looking for something to fill the gaps between Game of Throwns and The Walking Dead. I found this show by pure chance. I decided to start watching it and could not stop. Interesting plot line and compelling characters, it is actually a network show and I get that network but I never have seen a promo for it. It is another show I want to see go on for many more seasons.
3.0~Impressive... jack02 Sign in Permalink ...ly bad. I've watched five seasons and plan to continue, out of a sense of duty or habit more than anything. Series pros: There was one decent episode in the middle of season three, and it's the lowest rated one on this site! Fun to laugh at how dumb it is. Sometimes. Series cons: Characters never make logical decisions. Characters are wildly inconsistent. Consistently inconsistent, even. Even when you think you know what they would do based on what you've watched so far, they won't. Horrible corny dialogue, where one character will say something and you know the exact hokey line the other character will respond with. Giant, enormous, distracting false eyelashes on all the women. They're fighting for their lives with limited resources, but they always have time to put their lashes on, from their hidden, infinite supplies. Plot armour. Yes, main characters die occasionally, but never when they actually should, and less and less over time. Two main characters could have died at the end of season four and the show would have been better for it, but of course they don't. Countless characters survive the end of season five illogically, then the writers arbitrarily decide some other characters will leave the show instead. The two characters in my previous point then go on to create all the conflict in season five. One in particular is basically the villain of the season, but the writers don't treat her that way at all. Countless very poor creative decisions. At one point, a group of characters fight to the death in a sort of tournament. Do any of the somewhat interesting supporting characters survive, or just the most boring main characters? You can guess the answer. I could go on and on, all the more if I watched the show again from the start and took notes as I did so, but unless someone paid me to do that, there's no way that's happening.
10.0~Starts annoying, gets better and better with each episodes deschenes-phil Sign in Permalink In all honesty, after the two first episodes, me and my wife wanted to quit. The teen characters really got on our nerves. At this point, we would've given a 2/10 rating. We finally decided to give it another chance and from episode 3 to mid season 2 (where I'm at at the moment of this review), I can say that every episode gets better and better to the point that I cannot wait to see the next one. I understand now that the writers probably wanted to show the personality changes from brainless teen idiots to more complex, dark characters due to their environment. Yep, there are holes here and there in terms of realism, but the fact is that we are utterly entertained, and there are many "WTF!" moments. Extreme pace, great intertwined storyline (Grounders/Montain people/Reapers, etc.), many great characters, great overall environment design and costumes. Oh, and did I mention : VERY ENTERTAINING!!!
10.0~I think it's an amazing show, the first few episodes are pretty bad but if you give it a chance it'll get better :) kotypresents Sign in Permalink I started watching the show in 2015 and i still love it, there were some episodes that i didn't like but the show's still amazing. If someone wants to start watching it, it's worth it :) I love the characters in the show, they're very unique and developed. P.S:Sorry for my English :c
9.0~Great show! cdymally Sign in Permalink Season 1 took a while to find it's footing, but the site has been amazing since season 2. Clarke and Bellamy are the core of the show. There are no good guys and that's different and refreshing.
8.0~It's getting better with each episode zhenekas Sign in Permalink Should be ranked higher and deserves more attention. It does start with a bunch of plot holes and a few terrible episodes in the first season, but it's getting much better later on. Like some reviewers say just breeze through the first season and wait for awesome stuff to happen If you like the genre (post apocalyptic that is ) it's great and easy to get hooked on. Pretty good on violence. One thing is very annoying is that writers are holding on to the characters, but i guess we got spoiled by Game of thrones and Walking Dead being bold in this department. So if you into fantasy, apocalyptic stuff go ahead start watching it. I give it 8 out of 10.
8.0~If you like the Hunger Games you're going to love this adi-bac3 Sign in Permalink Seriously don't understand all the negative reviews- to the point where I'm starting to wonder if theres something wrong with my taste. I loved this show from the first episode- it's got a very cool lord of the flies/ hunger games vibe to it- it's not grusome or difficult to watch, the characters are very likable, it's got heart and tons of friendship, basically a bunch of teens trying to survive in nature (or rather nuked nature that changes the survival game a bit.) lots of actors that are easy on the eyes (Shallow I know... But it's the truth :) what's not to like?
7.0~Decent show that gets overwhelmed by teenage-drama subplots edhuang-toronto Sign in Permalink Watching this show, you have to understand that it's basically a YA or youth-oriented premise. The sets are very good, and there are some strong set pieces and basic plot lines. The drama and characters can, at times, shine in the stark reality that the characters must learn to live. However, what drags this show down from being an excellent sci-fi series for the ages, is the over-use of overly dramatic stand-offs. Characters will suddenly act a certain way or make decisions for no other purpose other than to create drama, or tension with another character later on. Almost all action sequences will be inter-cut by characters "pausing" to address these emotional drama issues that were obviously created just an episode before to set up such a confrontation. There isn't a single decision made that isn't also used to put characters against each other for future plot use. If this obvious soap-opera technique was not used as much, this show would be much much better. Basically, don't get too attached to any character because they will make decisions that contradict earlier traits or their established character just so the writers can create more dramatic conflict later. It's like every event in the story must be mixed with over the top betrayal and emotional conflict.
5.0~Flawed, but premise and plot twists kept me hanging on regardless tristanpronk Sign in Permalink Let me start off by saying I'm usually the type to hit the kill switch on any movie or show that reveals it's stupidity early on. In the 100, that moment comes pretty soon. But the premise appealed to me so I was willing to hang on for a little longer. Just long enough to be around for the plot to make it's first interesting twist. More were to follow. And although the whole (at least after the first three seasons, but that's a lot) has a bit of a shallow feel to it (the musical intermezzo's sure don't help) and the plot has some pretty big holes and cheap getaways on offer, I was entertained and am now waiting for the 4th season. If you are looking for something truly substantial, you won't find it here. But at the core, it tells a story that's worth hearing out. I can't say I'd recommend it, but I can't say I wouldn't either. If you're on a serious mission to kill some time and you don't know what to go for, I'd say it's worth it. Light, but definitely not completely bland.
1.0~who watches this? kopoko Sign in Permalink It's been 2 seasons, and to my shock it's up to episode 13. Who the hell watches this? teenagers? old people? I just don't get it. it's so awful it's ridiculous. It has a like 10 people on r e d d i t who follow it. 10 people. If one could get cancer from the TV then surely this would be a contender. Ebola, AIDS, West Nile fever all in one transmitted straight into your brains. It's been 2 seasons, and to my shock it's up to episode 13. Who the hell watches this? teenagers? old people? I just don't get it. it's so awful it's ridiculous. It has a like 10 people on r e d d i t who follow it. 10 people. If one could get cancer from the TV then surely this would be a contender. Ebola, AIDS, West Nile fever all in one transmitted straight into your brains.
2.0~OVERRATED... People need to know... the cast is a joke... pavanki-67595 Sign in Permalink The cast... the main characters, especially Clarke and Raven are a joke, to be honest they are not acting but over-acting... direction is amateur... 'Under the Dome' is far far better than this, the cast is strong, they know what they are doing and the story is strong too with a brilliant direction... I bet whoever has seen 'Under the Dome' would agree with me totally... GO WATCH 'Under the Dome', if you still dare to watch 'The 100' I am sure that you will start cursing the characters like you never did before...
10.0~In one word Entertaining! dyutijaha Sign in Permalink I was not at all into this genre of TV shows/movies, more into the comedies. So I was randomly browsing Netflix and started watching The 100, and what can I say...I got hooked to it. The show has a good plot to start with and now has multiple story lines (I'm talking about season 2 & I hope it's not a spoiler), which makes me more curious to know what's about to happen next. It might seem like it's a teen thing...but once you realize how all the characters grow with time and how they blend with the plot it's pretty entertaining. And I personally think the makers did a good casting and most of them are doing good at acting their roles. Though I feel Raven overacts at times. So in a nutshell, The 100 seems to be a on good start as they proceeded to season 2. I hope they will make their storyline more interesting and mature the characters further.
8.0~Keeps getting better season on season, dark post-apocalyptic science fiction drama mayank09876 Sign in Permalink The 100 is a post-apocalyptic science fiction drama, it got an interesting idea working for itself. The story revolves around on how humanity survives on a space station called the Ark after a nuclear war has made Earth inhabitable, the rules are strict, everything is rationed and there is less than four thousands of humanity left. After 97 years the Ark has run out of time so they decided to send a group of 100 juvenile criminals to Earth to see if it's survivable, their crimes are simple stuff like stealing food or getting drunk. (3/5) Season One: It was good, with lots of action and events happening both on the Ark and the ground. The episodes revolve around the question of leadership and survivability. On the ground there are the grounders hunting down the 100 and on the Ark there is a race against time with limited oxygen supply. All the characterizations are good, no straight good guy or bad guy, making for complex and compelling characters. The season was full of cheesy dialogues, poor script and some minor plot holes but it still manages to give us some gems and plenty of unexpected moments. The season ended on a high note with the introduction of the mountain man. (2/5) Season Two: The story revolves around the three distinct groups struggle with each other - Sky people (People from Ark) vs The Grounders vs The Mountain men. Alliances are made among them and how this brings internal divide among each of the individual group. The plot holes and character flip made me frustrated. In trying to surprise us they just threw storytelling and plot out of the equation. Yes, there are plenty of twist n turns, gritty scenes and many gems but overall I was annoyed. That didn't stop me from binge watching it, its entreating but vexing. (5/5) Season Three: I loved it, the AI A.L.I.E bought the craziness to a whole new level, we also get a lot of historical background on what actually happened to lead to the apocalypse. With a distinct central villain who is someone other than a human, we can blame all the mess and suffering on someone other than mankind for change. Also, the city of light brings in great world building to this dystopian world. This season is full of edge of seat situations, emotionally fuelled confrontations and central cast members getting killed. The plotting and pacing are extremely fast paced with plenty of well-crafted fight sequences and superb unexpected benders. I did feel some of the dialogues and question on moral boundaries was not needed this late in the series but they were just a few minutes of those. This was by far the best season for the series yet. (5/5) Season Four: The end of the world is here ones again, with it the race to save humanity with each clan trying to be the one to survive. Alliances are made and broken frequently, people drop to new lows to survive. Loved how they make these people turn into what they fought against in earlier seasons. The series keep growing on me, by now I have stopped vexing when a nice character takes questionable decision on matters of life or death. The ground rule is clear the creators of the show will keep throwing the question of moral dilemma, the human brain vs heart, the complexity of personal emotions and the conflict of what's the right decision, where to draw the line. This series had some popular one-liners one of them being "Maybe there are no good guys" which best describes everyone in the series. The season ends on a high with some crazy twist n turns.
1.0~DO NOT WATCH-This show is dangerously traumatic for oppressed communities. jskye-72308 Sign in Permalink This show needs to be removed from the Network. No should have to bare witness to the horrific third season. The racist and colonialist undertones become clear. A black man is shot at point blank rank execution style in the mud. They utilize incredibly harmful and quite frankly disgusting tropes such as, women in refrigerators, killing queer characters, specifically lesbians, and having bi characters suffer after every lover. This show had such potential after season two ended that I am simply appalled at the direction is has taken. It's use of religious stories and iconography is blatantly disrespectful. This form of story telling is gross and dangerous. To see a main character continue to be abusive both to his sister and his friend is contributing to the cycle of abuse that young women face. I used to be proud of the diversity on this show and of how feminist it was. I can't believe I was ever so blind as to put my trust in this industry. It is not a mistake I will make again. Please remove season 3 from international servers, and do not make season 3 available for anyone to see. I've hated to see the 1OO it become such a disturbing show. It's become pornographic in terms of shock value, senseless violence, and sexual assault. Don't ever watch or support this filth.
7.0~A joke of a sci-fi, completely unrealistic with questionable plot holes - but enjoyable if you get over the hump lorcanrees Sign in Permalink The first two episodes are are not only incomprehensibly unrealistic, (a recurring theme) but are also badly directed, with poor acting. If you persevere beyond that point, you're most likely to find it highly entertaining; the character pool is rather interesting, as well as the ways they develop and the clashing of personalities, as well as the inevitable action that the show entails due to the presence of Grounders. However, if you're a picky watcher who refuses to accept anything that contradicts the world of science, do not even bother. There are an uncountable number of things in this show that goes against what 'would' and 'should' happen in this particular scenario. To name a few: everyone, and I mean everyone has a Northern American accent There are 100 juveniles out of 4000, that are all roughly the same age After 96 years, they spontaneously decide to send 100 people down, all of which are young healthy people, something that would be vital for the preservation of the human race They don't send them down with any source of communication other than a wrist band that monitors their heart rate In season 3, the transmission of blood between those who are not affected by radiation and to those who are, would not have the effect of completely eradicating what radiation does to the tissue Blood types? The radiation level on the arc are very different to that on the ground that has undergone nuclear disasters. Its a bit of a stretch to assume they'd be immune. And if they were, why did no one think of this in 96 years. They talk about natural selection of the Grounders being responsible for their survival. Its been 96 years... Somehow, the only living people on earth are positioned directly next to where the 100 landed - oh and they have resided to prehistoric dressing and hunting styles. It seems as if whenever someone NEEDS to get to the ground, there is suddenly a giant revelation in which they devise a way to do so, as well as succeeding against the insurmountable odds. Every injury is healed within what seems like a number of days despite the blatant lack of equipment. And there are more, much much more. However, if that sort of stuff doesn't bother you, and you are looking for something that will entertain you with a combination of plot twists and action, then I'd recommend the show. Season 2 does a good job of continuing on from Season 1 which sets a strong enough setting, so there's a essence of fluidity. (Have not yet watched the third season so I can't comment on that)
6.0~a cheesy serial movies putraleo-79859 Sign in Permalink I think that this movies can do little better with the story line, every decisions the main characters choose sometimes make us thinking "is this the correct way to make a movies?". The things was this movies full of BS. I hope that the every ending of this serial season can be closed with perfectly and nicely job. In season 3 all of the people from the second spaceship can just say " If Farm Station don't want to listen then just walk out from this land."
10.0~The 100 kleemorgan Sign in Permalink I love this show. I hope the story line continues to hold me on the edge of my seat. I don't care if it is far fetched for some. Not for me. You would expect teenagers and kidults to be far more intelligent than we are now anyway. People this young will not get sick as their adult peers would, although I would expect babies to be popping out everywhere unless of course they have an automated birth control thing going on. Rampant jealousies that we are seeing on a low level would be typical for this environment. They need to elect specific jobs for the right people. We haven't seen this yet. They would have to do job interviews so that eventually we would get to meet ALL the survivors. Long reign "The 100". Nth Qld'er
1.0~Another low life, low budget series. pantazopdim Sign in Permalink 1 out of ten rating is just too much. So is watching the first five or six episodes of season one. I have to agree with all negative reviews. All in all, there is nothing realistic or even justifiable in the 100. It is clear that the series has no specific plot and is willing to follow whatever script path makes its primary target audience happy. And who that audience may be? Twelve to fifteen years old, no doubt. For the rest of us, there is nothing to be expected from the 100. Do the kids want black painted eye pilgrims from the medieval ages? No problem. Do they want invinsible, charming good guys with an inclination to rural sex? Sure. But apart from those two corner stones this series is nothing more than another low life, low budget, less than mediocre TV show that succeeds in one thing: to make angrier and angrier every time you watch the first few minutes of an episode. Sad.
9.0~I don't know why there are so many bad reviews. kittycatcaity Sign in Permalink I was hooked from episode one, I didn't think that this show would be amazing but now I am binge watching the whole series. People say that it has bad acting, plot holes and bad scripting, but I think that it's a pretty good series and that people should give it a chance. Not everyone will be hooked on episode one, but keep watching, I think it's worth it.
