10.0~One of the best... HIGHLY RECOMMEND ajcareyfilms Sign in Permalink Okay, let's be honest. Sure, the show has a rocky start and seems to be one of those clichÃ© teen dramas. Even I can admit that. It'll feel cringey in the beginning, and it's understandable that some might not have the patience for that, but for those of you who do, I ABSOLUTELY, 100 percent, encourage you to stick with the show and watch it. The show was trying to find its footing in the beginning like many other shows, and now that it has, I can honestly say that it's my favorite show on television. The 100 challenges the characters and viewers, and is one of the most politically immersed shows I've ever seen. Sure, it's sci-fi set in the post-apocalyptic world of Kass Morgan (author of the books), and people may deem it unrealistic, but that's what a lot of sic-fi is. These kids are trapped in a world on their own and have to accommodate to environments that they only understood behind a glass cage and never experienced for themselves. Information and learning only went so far. As you get into season 2 and beyond, you'll understand how politics plays an important role in the show, and that the CW has done a fantastic job of creating these characters and developing them into the people they are. I'd love to talk more about this show, but I don't want to spoil anything for anyone, so you'll just have to watch and see it for yourselves.
9.0~Half Sci-Fi half Mad Max. shaolinmasterkev Sign in Permalink Half Sci-Fi half Mad Max. This show is good, quality of episodes can vary. Gets better as the seasons progress! From season to season the characters alliances seem to change for no reason, just so the writes can have new drama.
10.0~Best sci-fi series ever made migsnnn Sign in Permalink I signed up to IMDb site only to write a good review about The 100. Because it made me sad then I saw that It's popularity are dropped. I'm not a movie fan and not an expert. I just believe that people who created the show it's very talented, hard-working, and what they've done (and I hope will be doing) happens only once in a life time. Even though first series it is not very impressive (I stopped watching show after first episode, because I thought It is just another cheap show who wants to become Something), it is getting better and better episode after episode. And now, then season 3 ended I'm thinking that this is the best apocalyptic type series ever made and I consider myself a little bit addicted to this fantasy (though very realistic and quite likely to happened some day). Great things about this show: There is no stupid teenage love stories. No sexual bullshit. Love stories are real. People die. People suffer. The story-line of the show is very intense, it makes you feel unsafe, and teaches you that it's an illusion that in our reality we feel so safe, it brings you thoughts that if something happens ( and it could happened in any time), you will have to survive only, and you won't recognize yourself then, you'll do things that you never knew you could, or you always said to your friends in front of table full of food and drinks that you NEVER EVER DO that kind of things. What if you will do? What if your sister would be tortured? What if you had to kill someone to survive? And These things makes THE 100 so good. Because even though it is sci-fi it plants thoughts in your head, that it could be, that you live in a comfort surrounded environment and you do not know ANYTHING ABOUT YOURSELF. Thanks for those who are reading. I wish you the best. And if by any magical coincidence someone from the 100 team reads this, I just want to say: Stay on this track, don't put bigger boobs on girls, don't do stupid sexual bullshit. Keep it real, keep it perfect. Thank you for making my life more awesome by bringing me (and all who watches), into another reality.
5.0~Mediocre brimsurfer Sign in Permalink The show started off on the right foot, it was really good. I got hooked on it but then it started going down hill and the plot, the story direction and the decisions made by characters became unrealistic. Many key characters appear to be hypocritical in their actions as the show progress. Also one thing that bothers me is that the show has females in most of the relevant roles and power positions. One may think that the show has some kind of feminist agenda although I don't know if its the case or not. But it does seem that an explicit effort is made to put women in power positions in this show. Men are given rather irrelevant roles and this adds to the unrealistic-ness of the show. Also acting is not very good, actually its horrible in some scenes. I am giving this show 5 out of 10, the show could have done a lot better with a more realistic approach, better acting and better balance of power between genders.
10.0~absolutely love this show - no spoiler please read. maceachern28 Sign in Permalink I seen so many bad reviews on this show so I made an account to express my thoughts. As soon as the first episode ended I had to keep watching. Just finished the first season and i am praying there will be more. The idea of this show is amazing especially due to the heating of nuclear and chemical warfare lately. I would love a season 2 and see this show carry on. If the producers of The 100 are reading this please make season 2 and carry on or at least conclude the story. I want to learn more about the grounders, the space station, the toxic cloud, the state of earth before they went to orbit, what happens with relationships and so on. There is many different ways this story can go. Please continue this show, and most of all don't be afraid to be creative and make this show "The 100" a series to remember. Make the haters bite their tongue! 10/10
7.0~Give it a chance...and you'll find it has a number of redeeming qualities. DarkWandererAU Sign in Permalink If what you prize most is edge-of-your-seat suspense and captivating character development...then why the hell are you still reading my rubbish review? YOU SHOULD BE WATCHING THE 100! From the start of the first episode you're pretty much gripping your seat, even though you haven't had time to form a connection with the characters yet. As other reviews have said, the first couple of episodes are the hardest, but its the characters that makes us not want to switch it off. Each episode brings a new challenge that the main characters have to over-come, which makes each episode as epic as the last. I swear, if my life was as eventful as those of the characters in this show...I'd probably just end it all now to save myself from dying slowly of stress. With each new challenge comes decisions that need to be made, which ultimately affects a characters standing within the group. Which is even more gut-wrenching in the first few episodes when you're unsure about each character. Basically, the first few episodes you'll be playing "pin the alignment on the character". But once you see their true colours, you'll be all "of course he/she is that way, how did I not see it". I could go on...AND ON, about all the good points of the story line and reveal how mind-blowingly awesome it is. But that would be telling. But I will give you a tiny taste into the characters. Clarke: Blonde, blue eyed with a spectacular set of...*clears throat*, sorry where was I? Clarke is your protagonist, it is through her (mostly) that we learn what the F is going on. I would have to say one of my favourite heroines to date. A lot of strong, female leads these days just lay it on too thick. But I have to say, I kind of like Clarke. She has a good balance of brains and balls. She leaves space as a child and arrives on earth as an adult...and we see this progress more & more. She doesn't forgive her own weaknesses lightly, but is quick to forgives others for theirs. She puts the safety of her people above all else, sometimes stupidly so. You will, of course, see her pay for some of those decisions. Bellamy: This guy...this guy had me hating him for almost the first half of the first season. Now he is pretty much my favourite character. He is the self-imposed leader of the group (well, co-leader with Clarke pretty much). The thing you need to know about most of the teenagers that were sent to earth, is that their lives have always pretty much sucked (with the exception of Clarke). Bellamy got the worst end of the deal. His duty to his sister, no matter how happy he is to perform it, is a burden he carries. As you will find out, he feels responsible for his sister more than he should and will do anything to keep her safe. He is a strong, sometimes ruthless leader, and those tough decisions are usually made with the well-being of his sister close at heart. A true ultimate bad-a**. Kane: One of my favourite actors from Lost plays this character, and he does a fine job (Desmond, in case any of you are familiar, minus the Scottish accent). You are always so back and forth with this guy. Is he good or bad? Do I like him or do I hate him? If I met him, would I give him a hug or put my fist up his balls? His "villainous" actions really grind your gears. But there are moments with this guy that almost make you bloody weep! He is definitely not beyond redemption, its just whether he WANTS to get there or not. He hides his caring for any individual under a cold, corporate exterior. But when something truly matters, his human side comes out and totally takes you by surprise. Chancellor Jaha: Like Kane, Jaha is middle-aged but is also the leader (Chancellor) of the Ark (the name of the space station everyone lives on, in case you weren't keeping up to date). The first few episodes show the Chancellor as this oppressive figure, the dominant government head who will stop at nothing for "the greater good", even if it is at the expense of innocent lives. I won't lie...his balls had a place for my fist as well after the first few episodes. But once again, we see massive character development, and he is one of a few characters to have a moment of clarity and see the "error of their ways". I ended up liking him, and there is no doubt he is a good man. He has just made some poor decisions. OK, wrapping it up! Things that make me want to watch this show. No character is fully good or fully bad, definitely keeps things interesting. This show is like Lost, in a sense that a bunch of people are stranded in a strange place and have to compete with god knows what. Mystery lurks around all corners, and its not in a lame way either! Its actually fully captivating. You know how when you are watching Game of Thrones, then suddenly out of no where something really violent and shocking will just happen? Same thing in The 100, and I thought the only show that could shock me like that was Game of Thrones...boy, was I wrong! Finally...THE CHARACTERS! Seriously, despite the loop holes and plot holes...this show really is all about the character development. Even the more minor characters are interesting in their own right. So when you're not busy digging your finger nails into the side of your arm chair, just sit back and enjoy the chemistry and development between the characters. The 100 truly makes for an excellent TV experience.
10.0~Great first season philip-paine1 Sign in Permalink On the whole a great series. The love triangles, plot holes, and ability of the characters to keep up model like appearances in the woods, only slightly detract from what is a surprisingly well written and acted series. If there is any show on TV right now that carries the torch BSG left it is the 100. The characters face real moral dilemmas, especially those left on the Ark. Many of the characters have developed substantially over the course of the first season. I have been impressed with the depth that the writers and actors have brought to characters like Kane. Overall, if you are a sci-fi fan, this a great show and well worth a watch. In my opinion, it is currently the best sci-fi on television hands down.
10.0~Amazing and love the actors. kusjuh_lisa_xxx Sign in Permalink I did watch the 100 one time earlier and I stopped at season 1 because it got bit bored but you just have to go trough Because of all the seasons has a perfect story of telling to make a decision when there really is not good decision at all. Some Characters are just going trough a lot and still keep fighting.
8.0~This show is going places. cmegala Sign in Permalink If you're reading some of the other negative reviews, don't. They have no place anywhere near this show. Not going to lie, I thought that 'The 100' was a dead end show where they would just end up dragging things out, but somehow they surprised me. So far I'm understating. If you've seen season 1, then you'll understand when I say its pretty 'meh' but season 2 is an absolute killer and if you watch on, you'll have more mind blowing, heart-rate increasing, edge of your seat moments than you can count. Somehow they took the concept of unpredictable and reshaped it to give us the enigma that is 'The 100'. Every episode could be a movie in itself with it's plot twists and immense character development. What seemed like a dead end show has now blossomed into an intricate maze of fine showmanship. I still don't know how long this show is going to manage to keep up the intensity or how many seasons it will undertake, but at this point I'm not too worried because they've managed to prove me wrong so far. If you have any doubt that 'The 100' is a poorly executed show, give it a chance and maybe you'll like it. Sometimes I just have to hold my head and wonder how the hell they're going to get out of that one.
9.0~Can't believe this on CW! Very Dark elsidaliaj Sign in Permalink TLDR: JUST WATCH IT. Season 6 is slower but still unique. I can't believe this is on the CW, can't imagine how much better it would of been on something like HBO. The show devolves into pure madness as the seasons continue on, to Mad Max levels. Yes it does start off as teenage twilight drama but then it goes into WTF how did we end up here, how is this much brutality even allowed on a public channel?? Sci-fi is the backdrop it is a moralistic drama type of show like the walking dead, but much much better. If you thought the moral choices on the walking dead were anything this turns it up to 100%. It's also not pure sci fi in space, it's also the doomsday apocalypse, with mad max and the hunger game thrown in! Plus some of the most messed up things you'll see in television in a while. Each season just gets better and better, something 95% of shows can't pull off. Characters die at a brutal pace like the game of thrones, and that is only episode 3 of season 1 which some said were very slow. Now let me tell you why it's a 10 in my book besides it's shortcomings of not so great dialogues and questionable acting at times. There a few gems where you are like woah that was pretty good. The reason why it's so good, and kudos to the staff is the sheer amount of material per episode, each episode literally feels like a season within itself. The only other show That had this kind of pacing action was UKs Utopia. Even Westworld season 2 was a snorefest. If you're tired of the walking dead's or other shows dragging along a plot point for a whole season or 2, this show is for you! An example is season 5 episode 1, there is a mysterious spaceship in the scene every other show would of made you find out the mystery after dragging it out for a whole season, here you find out the next episode and things get rolling. Also the sheer unreliability of the plot is great too. I was recently watching an episode and I expected something to happen maybe because of say season 2, and all of a sudden the complete opposite happened. Expected outcomes are literally a 50/50 coin flip. Most other shows I'll jump on my phone and multitask zone out a bit this one I can't everything is interesting. And the universe keeps on expanding I could see the plot going in so many different directions. It's either pure genius to adopt this show or sheer luck given the unlimited possibilities, as opposed to Zombie apocalypse simulator with different backdrops of other shows. Don't pay attention to the scientific realist NASA scientists who supposedly watch realistic FICTION all the time, get it? Haha
10.0~"Addictive" venter-c-d17 Sign in Permalink This series may not interest everyone, but for those who love a good Fantasy/Sci-Fi, with a little Romance, and a lot of Action and Drama, then this is the one for you!! It starts out a little slow in the first few episodes when they still on the "Ark" and "when the 100 first land" but once it gets going and they start meeting the dangers that face them on earth, you can't stop watching as it pulls you deeper into their world. It had me on the edge of my seat at times and with the second season leaving you not knowing what next is going to happen with so many twists and turns, it makes you want more after each episode. The story line is very well written and draws you into the teen's difficulties as they try to survive and defend themselves while trying to be better than those before them. The acting complements it really well and furthermore the cast has been brilliantly put together to suit and fit every role in this series. With the third season around the corner and promise of a lot more twists and turns, and more action packed episodes to make you beg for more!
6.0~Not so great caprica20 Sign in Permalink I watched first episode. From trailer it seemed to be interesting show, but expectations did not came true. Episode without flair, surprises, or any significant emotions. Behaviour of the characters completely idiotic, but you can justify this by age of the characters. It just hard to watch. Action focus on two places, on earth and on cosmic station, where I must say things looks much better and more interesting. In this two places we have groups of people with different point of how to do things. IMO show could be much better if they would send adults instead teenagers and show us intelligent show with drama and mystery. Choosing teenagers acting like 12 y.o it's just hard to watch, you get angry watching their actions. They don't do what they should do, don't think whatsoever, no responsibilities etc. I don't see how you can drain satisfaction by watching something like this. Fortunately we have two characters which behave reasonable (for the show standards) I think we won't get any mystery, there is nothing pointing this element would be added in the show. Besides that, The 100 is pretty. Good effects, cool views, like landscapes and 27 y.o Marie Avgeropoulos playing girl with the name of the low budget car model, Octavia, showing her charms in first episode. For time being I staying with the show, it was only pilot. For sure is better than Helix(at least for me.) Unfortunately I'm afraid that The 100 will be a dud after all. But you can give it a chance. It's not like we have headache from amount of SF shows on the market.
8.0~A series of unfortunate events hielkevansplunder-09897 Sign in Permalink This is one of the better series I have watched in a while. The story line is thrilling and sometimes it even got me carried away. Like other people say, you just have to except the ludicrous/unrealistic events that happen in the series. Just a few things that are still bothering me after watching the first 3 seasons. 1. Humans that lived their whole live at zero-G have bones as strong as chalk, going back to earth with these bones would be painful/unbearable for them. 2. The fact that the grounders have their own language, but also seem to speak proper English. Also it sounds really dumb and painful to the ears (especially the catchy phrases like ''jus drein jus draun'') 3. The characters on this show can't speak a dialogue without saying ''I did it for my people'' annoying as .... 4. In every situation in which they have limited time before the enemy comes or whatever, they start heart to heart conversations in the heat of that moment. Although this made the particular scene more exciting (watched a few of those scenes on the tip of the chair), it is also completely unnecessary. You're just keep asking yourself, why oh why is this happening.. I really enjoyed the series so far. Season 2 is the best one in my opinion. I hope the makers can keep up the level in season 4.
10.0~This TV is just magic! luu-05999 Sign in Permalink When I started watching The 100, I though it was OK, BUT, as I kept watching, I got more and more into it. The TV show contains all the aspects of the big TV shows from the 2000's. At the middle of the first season they combined zombies, the end of the world and human race extinction all together. It is done beautifully! They mixed the human nature with the futuristic technologies, fears and mistakes that we have done throughout history. The first thought that crossed my mind was at the end of season 1 "this is the new LOST TV show!" I couldn't stop seeing scenes and situation that were presented in Lost. Another aspect to point out is the performance of the actors in it, they progressively got better at interpreting their roles and gave more value to the entire TV show. I think the season 2 is one of the best season of the whole year 2015. They took the story to a new level and my mind exploded with the excitement, intrigue, and the love I get from pure science fiction. I hope they will continue this TV show for long, it is the new boom of the 2010 generation TV shows <3
1.0~Failing after 1 minute alexanderb04 Sign in Permalink This series totally fail almost immediately. The idea that the human race would only have a vague knowledge about planet Earth's status after orbiting the Earth for 97 years is so ridiculous near to insanity. What about probes be sent to Earth? No, let us send 100 juveniles. The knowledge about radioactive levels, wild life and so on would of course be known to the humans before they start to send people to Earth. And especially juvenile people. :-) And in our times with so many successful missions to Mars with probes it is beyond understanding how the writers thinking here. A tip to the writer's of this series. Get a consultant from NASA next time.
10.0~extraordinary haider1253 Sign in Permalink I think it's the best science fiction in the history of the television TV shows because there is no boredom, always juxtaposing and giving a lot of enthusiasm, and full of action-packed scenes I think the series is integrated in all respects
5.0~Scifi brainwash. davidcevans Sign in Permalink I started off watching The 100 and was glued until the third series. Too much disappointment in the story line. Its like the writers have gone out of their way to emphasize the hardship. Makes me wonder: the story line seems to parallel the historic Jewish struggle and the Zionist agenda. Expelled from their home land into a life of exile, the struggle of recreating the homeland, the acceptance of the thirteenth tribe, The mountain men. Watching this will probably help you understand the war in Syria. I started off watching The 100 and was glued until the third series. Too much disappointment in the story line. Its like the writers have gone out of their way to emphasize the hardship. Makes me wonder: the story line seems to parallel the historic Jewish struggle and the Zionist agenda. Expelled from their home land into a life of exile, the struggle of recreating the homeland, the acceptance of the thirteenth tribe, The mountain men. Watching this will probably help you understand the war in Syria.
10.0~Amazing alessatziolis Sign in Permalink Literally one of my all time favourite tv-shows, the characters have amazing developments over the seasons and it never gets boring. A true must watch for everyone who loves some good futuristic series :)
4.0~So disappointing... tamkidd67 Sign in Permalink Basic premise isn't that bad, but 100 perfect teens trying to outdo each other with terrible overacting doesn't really work well. What are the chances of having so many perfect kids of that age in the brig at the same time anyway? Not to mention the ultra stupidity of all the characters. The same people continue to make the same mistakes over and over, and despite none of the 100 ever being on Earth, they all adapt effortlessly. Also seem to be no physical effects from growing up on a space station. Come on. Where is the food coming from? They picked some berries in one episode! Lucky they were safe to eat, eh? Time to put this show to bed!
10.0~Season 5 is UNREAL tori_ludwig Sign in Permalink I need them to finish production on season 6 already!!
1.0~Season 1 and 2 decent. Season 3 is horrible sjensenstrad Sign in Permalink This TV show was a 6 in Season 1 and 2, but season 3 is just horrible it is going no where. Trust the sky people, kill the sky people, trust the sky people, kill the sky people. And in the other camp, trust the grounders, kill the grounders, trust the grounders, kill the grounders. It is very boring and a waste of time. I have also lost interest in the story line of "City of the light" a long time ago, and now I have lost faith in that the story writers a able to pull that one off also. Not much going on in this TV show, the days of our live is a better scifi show at this point UPdate; It has turn even worse. Only stupid characters who is doing stupid thing all the time. And the show isn't moving forward, they still blame clarke for something she did long time ago, and the guy which girlfriend got killed then is still whining about it. And that Bellamy can just kill 300 grounders and no one cares to mention that. Someone wrote "best thing since Battlestar Galactica" guess you don't have access to much TV shows honey.
