6.0~Watchable megagurka Sign in Permalink I watched the first season of "The 100" before writing this review. If you can disregard the bad things about this show and are interested in the sci-fi elements this show might be worth watching if you have nothing better to do. It starts with a pretty cool premise that enables a lot of different plot developments. However there are plenty of things with this show that are annoying: The characters are very one dimensional, they are either very good or very bad. They also immediately know what has happened given one clue and what to do next. It's very hard to connect with and feel for anyone of them. The dialogue is very simple, filled with clichÃ©s and the lines feel very stilted. Nobody actually talks like this. Constant self sacrifices and self reflection by the main characters to make them look really good and to provoke some emotional response from the viewer. Frequent "cliff hanger" cuts in the middle of episodes which are preceded by the same annoying crescendoing music. Almost like it's made for inserting commercial breaks. This gets annoying very quickly. Lots of small side stories (look backs, romantic relations etc.) which doesn't add anything to the main storyline. They are basically just time fillers. Very little development actually occurs in the main story line in the whole first season. It could probably be compressed to about two or three episodes. I can see that many teenagers (mostly girls) would enjoy this show, but for the intelligent adult it's harder to consume. I watched Narcos before this and the difference is huge in terms of production quality and adult appeal. However, I will probably watch season two of "The 100" anyway.
10.0~First season reviews??? novica83 Sign in Permalink Why do I still see them? This show has evolved during it's seasons so much, it's ridicules to even consider critics from the first one. For example, episodes from last season have 9+ grades, all of them! Every season tells a different story, but all of them are about human character in tough situations, and that's what makes this show so special. My recommendation is to watch whole show and make your judgement by yourself. Cant wait for more new episodes!
9.0~Awesome Series amirgun Sign in Permalink Awesome, Awesome, Awesome Series. Everything is awesome.
3.0~Decent cast can't overcome horrendous script cransley-78942 Sign in Permalink Plot devices function exactly like every other future dystopia story ever. As far as the show's production, here's the gist: Get in a fist fight? Face blood. Get shot in the leg? Face blood. Stub your toe? Face blood. Every characters face is literally always covered entirely in blood no matter the circumstance. The production budget must mostly be taken up by the ridiculous amounts of makeup each episode. The cast themselves I think are quite good, given what they're working with. Eliza Taylor and Thomas McDonell do a particularly good job of remaining believable. If you want a very poorly directed, even less logical version of The Maze Runner, this is the show for you.
10.0~10 Stars, Best series with Mr Robot of last Year. Waiting for the 3rd Season maretto-77425 Sign in Permalink Best Series of the last few years with MR ROBOT. MUST BE WATCHED! Suspense and great story. So bad I have to wait an year for the 3rd season, I give 10 stars cause this series entertain and give big suspense in every single episode. Also it s very interesting to see how characters and the people change the way to behave during his life on Earth and Space, facing the death and wars everyday. Each reactions of the characters was absolutely realistic, and the psychology of all of them has been well treated. To be honest, I would not even think watching this series how "it's possible they have mascara and make up" available in the space after 97 years as a read on a review below. Quite weird reading this on a review, I d like to make you understand you're watching a TV series not a science documentary on the BBC, so you should pay attention on other mistakes that usually are made in other shows but not on this one! Obviously not everything is so realistic ( but who knows if in the future it will), but I repeat, it s a TV Series! I absolutely suggest to watch The 100, if you like SCI-FI/Futuristic Movies for sure You will enjoy it. 10 Stars till now, waiting for the 3rd season next year!
10.0~GOOD. Interesting story, good actors, nice science-fiction elements. DON'T listen to the stupid negative reviews from teenagers' haters. michaeljustgreat Sign in Permalink I read the three reviews currently available and they are all negative! Why? Because it involves for this particular first episode mostly 17 years old teenagers!! As if it would automatically mean bad when there are teenagers involved!! The same stupid negative comments were made for the Star-crossed TV series and in fact it appears that Star-crossed is very good because it has a very good story and the actors are excellent. Same with the 100 TV series, despite the idiots who do not like TV series only because there are teenagers involved, I find this first episode of The 100 to be very interesting. Even though I am an adult, me I do like teenagers when they act well in their roles and when there is a good story to support the TV series, as it seems to be the case at least with this first episode. So, teenagers or not, I will keep watching this TV series. That means that it is very likely to be a very good TV series in the coming next episodes, as the first episode demonstrates. Update: After seeing episode 1 that was very interesting, episode 2 confirms this first impression, as episode 2 is also very interesting and you really want to see the next episodes. It proves to me that this TV series The 100 will be nothing short of very good to excellent. The lesson on these negative reviews: DON'T BELIEVE THE NEGATIVE REVIEWS. Update: do NOT take into account the negative reviews that come mostly from haters of young people, as a big proportion of the actors in this TV series are teenagers! I am an adult and I appreciate a lot this TV series. Here are mostly TV series and a few movies that I highly recommend, as I watched them and enjoyed them a lot. -------------------------------------------------------- There are a few classics in science-fiction TV series: ---Smallville ---Star Trek: Enterprise ---Babylon 5 ---Earth: Final Conflict ---Battlestar Galactica ---Star Wars (6 movies so far and counting) ---Jupiter Ascending (a movie) all deserving 15 out of 10 because they are all very special TV series for the quality of their stories and for the amazing actors that they have. Are these TV series perfect? No, as they sometimes have "filler" episodes that are not too great and they also sometimes have "holes", illogical elements in the main story or in the individual stories of particular episodes. Despite sometimes the presence of these very few shortcomings, these TV series are really unique and special in many ways that you will nevertheless enjoy them greatly. Other TV series that are excellent but not necessarily science-fiction? Here is my list of other excellent TV series that you will appreciate a lot: --A few more science-fiction: ---Battlestar Galactica: Blood & Chrome (it is science-fiction) ---Caprica (it is science-fiction) ---Babylon 5: Thirdspace (it is science-fiction) ---Space: Above and Beyond (it is science-fiction) ---Defying Gravity (it is science-fiction) ---The Tomorrow People (it is science-fiction) ---The 100 (it is science-fiction) ---Almost Human (it is science-fiction) --Non-science fiction: ---24 ---24: Live Another Day ---Dexter ---The Vampire Diaries (it is fantasy I could call it) ---Breaking Bad ---Kyle XY (it is slightly science-fiction) ---Nikita ---Damages --------------------------------------------------------
10.0~Fantasitc anotherwiltedwallflower Sign in Permalink I'm always fussy about what shows I want to watch, and when I first scrolled past it on Netflix I was skeptical. The first half of the first episode had me rolling my eyes but as the season progressed I realised it wasn't the typical lame angsty teen romance garbage that seems to inflame this genre. Long story short, I watched both seasons twice within a week... I think I'm going to start again now. (going through a bad time don't judge me.) A++ character development, seriously I couldn't be happier with the changes they all went through. Not everyone gets their happy ending that would usually be expected with this sort of show, and that's what makes it great. Yay.
10.0~I love this so much ssn-81831 Sign in Permalink It is so cool and I'd love to laugh and I love and I love drama of you I love her so much thank you all come today or not today
1.0~ridiculous garbage nwise903 Sign in Permalink first and foremost are there no longer a thing called satellites? and why wouldn't they send a communication device down with them. in a way its as if the movie idiocracy happened with a few smart people left. second the whole community thing is just.... dumb. all the kids do is a lord of the flies crap. all of their problems would be easily solved. second i hate when they come up with slang.... grounders? and the whole community on the space station just doesn't make sense the concept of "floating" and the council. if things really became what they are it would be a more survival of the fittest scenario and the people in charge would not be alive.
9.0~it feels like us julidreamgirl Sign in Permalink this drama touches me, I feel it, like it's gonna happen to us soon. we're gonna fight it, we're gonna have enemies, in our own culture or outside. all the ignorance of grounders, living like the first generation of humans, having wars for nothing and killing for nothing. it sounds really familiar even now, doesn't it? this show has some imperfections, but as you see I've rated 10 for this. because it shows the reality. that not all the people in charge can make right decisions. not all the leaders are perfect. not all the chancellors are gonna be nice as they protect everyone. because it's not true, they can't always be like heroes in fairy tales. they don't have super powers. they are gonna make mistakes and their mistakes are gonna haunt them forever. but as they go forward they'll be better in protecting and leading their people. I just wish when that day comes we can be better than grounders or even Clarke. anyways, I just suggest you to watch it. it's an amazing show for me, I hope you like it too!
3.0~Gossip Girl in the jungle yatsura-99282 Sign in Permalink Ignore all reviews, they got paid to lie. The series completely ignores the whole premise. Space station? radiation on earth? monsters? survival? The characters couldn't care less about any of those. "Oh we got expelled from our families to die on radiated earth, our shuttle crashed, several of our friends died and we are stuck in middle of a jungle without food or water? lets throw a party for 2 days!" Food, water and even makeup appear out of nowhere. Not a single actor attracts any sympathy whatsoever. It really is Gossip Girl in the jungle, therefor you see teenagers arguing about their relationships 90% of the series. Scripts are bad, dialogues are bad, actors are bad, studios are bad. Every episode is like Sharknado or The Room. Why other reviews give 10/10 stars? Read them carefully. You know something is shady if they want you to wait for the end of season 2 before you judge the series. No other series would get such reviews after 50 godawful episodes in a row.
8.0~Despite bad sci-fi, this show exceeded all my expectations by far farfarskalsonger Sign in Permalink When reading this show's generally bad reviews I feel obligated to share my point of view. I agree, this is not great sci-fi. To be honest, it's nowhere near great sci-fi. But still, i cannot agree with the hate it's receiving. Reviewers complain about a lack of logic and scientific relevance. My guess is that the average reviewer of this show is a committed sci-fi- fan, who crossed path with this show exclusively because of its genre description. You are not this show's intended audience. The lack of scientific accuracy does not make the 100 a stupid TV show, made for stupid people. Focus is not on the technology, but on the characters. This show has succeeded in something few shows targeting young adults ever do; it portrays ethical problems with relevancy and depth without making it clichÃ©. The group dynamic is a constant topic, and the slow rise of a strong, female leader is an always welcome contribution to the constantly relevant debate of gender (and female in particular) objectification. To anyone considering giving this show a chance; do so, with an open mind. The first episode, like most other pilots, is really bad. The whole concept of too much action squeezed into 40 tiny minutes that are to give a show a further chance rarely ever lives up to the quality of the "main" season. With that in mind, I would recommend you to give it a try.
10.0~The 100 is amazing ajmal-13382 Sign in Permalink An amazing show, can't find anything like it. All the characters are unique and well written. I enjoy a TV show that is not afraid to kill off characters. I hope the show stays for many more seasons. Reminds me a little of the walking dead, but I really enjoy TV shows with a good script. Great characters, interesting that many of them are from Australia and I think England. It's surprising they shot the Fottage in British Columbia, Canada, not many shows are filmed there. Many things are occurring in different parts and can't wait for the 3rd season. Really liked the ending of season and can't wait to watch more! And give all reviews 10/10!
10.0~Really Good mhkj33 Sign in Permalink This TV series is one of the best specially season two ,, the first one was slow beginning then started to be really strong and very nice ending but the second one its really perfect from the first episode to the end,, good job This TV series is one of the best specially season two ,, the first one was slow beginning then started to be really strong and very nice ending but the second one its really perfect from the first episode to the end ,, good job This TV series is one of the best specially season two ,, the first one was slow beginning then started to be really strong and very nice ending but the second one its really perfect from the first episode to the end ,, good job
9.0~Actually really good nasne87-1 Sign in Permalink OK, after reading so many bad reviews that I mostly found pretty unfair, I figured I should write one myself. If you let some small things go, and just focus on the story, this is actually a really great show. I'll admit that in the first two-three episodes the show was still trying to find its way, but it got so much better after that! I think people are forgetting this is an CW show. Yes, that means that even without a speck of civilization the characters are going to be wearing make-up. You know this, you knew it when the show started and for me it is not enough to completely burn the show down. Yes there are some problems with the science. But honestly, I dare you to find one sci-fi show on TV that doesn't temper with the reality of science. Look past all these complaints, just go with the story and you will find that the story is actually really good, that the actors are not bad and growing in their parts with every episode and that the show is very good at portraying the struggle of the people from the ark, trying to survive a hostile earth. Yes they make stupid decisions, but they have to pay the price for those and that is what makes this show so good. It does not shy away from taking the hard road.
10.0~This is one of the best series in the world!.. adir-81807 Sign in Permalink This is one of the best series in the world for those who like it and watched it. Those who did not watch the series to the end will never know it. I highly recommend watching this series !!!
10.0~awesome show rk248193 Sign in Permalink Guys I'm gonna tell you something i watched a lot of Hollywood shows and movies but this one of a kind. you can compare this with Game of thrones. if you are a fan of sci-fi,apocalyptic drama you must see this shows.i cant tell you guys how much this means to me now i m totally addicted to the 100. i think this is the one of the best show in this time.man the graphics is awwweesssomeeeeeeeeeeeeeeeeee if you wanna see a real shows that makes you fell that this is it i cant wait a minute to see another episode of this shows.i can tell you guys this the best shows ever ever made in 21 century and for director and writer please make at least 20 seasons. ps watch it
10.0~Please bear with the first few episodes, season 2 is epic and bloodthirsty like game of thrones toxinok-77914 Sign in Permalink Seriously stick with this show. I watch a lot of TV and when I first started watching the 100 I found the dialogue/accuracy questionable and it seemed like just another CW show. I stayed with it mostly for the interesting concept. And wow, the second season develops into one of the most exciting programs out there right now. The storyline moves around like lightening, the characters go on believable arcs which deliver amazing transformations in some cases, it's highly original and creates some fascinating dynamics between characters which you don't see anywhere else. OK it's not perfect (sometimes the science makes me frown) but it does so much right I barely pay attention to the increasingly rare blips now. Heading towards the end of season 2, every scene is compelling and feels important and you care about what happens because they have built it in the right way. Don't expect the fluffy love stories CW is famous for, this is in no way a show just for teenagers, it's not afraid to kill people, and deaths are permanent (thank goodness). The way they bring up questions of morality and strategy, the ambiguity of the characters, the head on approach to the subject matter, all are fascinating. It's gritty and edgy with excellent production value and the only other program I'm getting the same level of epic from right now is Game of Thrones. I've never written a review before but I just had to support this show and want it to get past any stigma it created in the initial episodes. Check out the ratings in season 2, those are earned and well-deserved. Binge watch it people! You won't regret it.
10.0~Starts Off Slow Then Becomes Amazing gerrydeb Sign in Permalink First off to all the naysayers just hating on teenage dramas because their based around teenagers and its the 'in' thing to criticize shows like that give it a chance and stop taking a biased pessimistic view on the show. Now to the review the show starts slow especially the first 4 episodes but by the season 1 finale i guarantee you will feel emotionally connected to the characters, intrigued by the undiscovered secrets future Earth has to show and on the edge of your seat after cliffhanger endings to amazing episodes leaving you thinking about the show for the whole week until the next episode is released. The Plot Development between characters may be very slow to start but by mid season 2 you have characters who originally hated each other showing romantic chemistry whilst best friends turn against each other. The show is increasing in popularity and with the bigger budget that comes with the renewed success i can only see the show moving on to bigger and better things. All in all a very good show that highly recommend sticking through with despite the slow start to season 1!
2.0~A good show? ashikmokami78657 Sign in Permalink Sci fy collision with teen melodrama describes what not to do in a good show. Worse character representation and dialogue, a r.i.p for a good story. This even makes the last season of lost masterpiece.
5.0~I'm in the middle of the road on this one. jerrycrow44 Sign in Permalink First off I'll say the SFX, CGI, costumes, scenery and actors of this show are great. Wow, that's a lot of great for someone to be in the middle of the road you might ask. True, but I haven't gotten to the writing yet. Yikes! I hate, HATE, when smart characters are written to do absolutely stupid things over and over again and have no common sense. I don't need to go into specifics because it happens almost constantly in every episode, at least it seems that way to me. Anyone can do stupid things SOMETIMES, but come on! I know people who never or rarely do or say stupid things. Can we get someone like that in this show to represent? Please? Also, it seems that anyone is an expert when they need to be. They are all IT specialists, marksmen, medics, demolition expert, mechanics, martial artists, etc. One example is Octavia, a young petite girl who has lived her whole life in a single small room when she wasn't hiding in a very small hole in the floor to avoid being floated. How she came to be a rather sex starved skank I'm not sure. Did her mother give her inappropriate reading material to pass the time when she was in the floor? I don't know. She did, some how, become a combat queen. Kicking butt and killing men and women larger and more skilled than she. I reiterate, she lived her whole life in a small room and in the floor. Sheesh. Do NOT tell me she got all that from 'grounder training', just don't. Next, I just finished Season 5 Episode 1. It starts off with Clarke coming out of the bunker she made it to with very little radiation damage to her face which was severely radiation burned at the end of last season. This is only 42 days after the Primefaya devastated most of the planet. I have a lot of WTFs about this. No hair loss? Thank God, she does have beautiful hair, I'd hate to see it gone or patchy. Perfect skin? Except for a few red patches in areas that don't ruin her good looks, she has perfectly healed skin, and I'm sure those patches will be completely gone in a few episodes. She leaves the safety of the bunker after 42 days when she and the others were to go in to space for 5 years to wait until it was safe again? Umm...why? Did she somehow realize they made a mistake in judging how long the radiation would last? 42 days vs 5 years is a big mistake. I've gone on long enough, and could go on much longer about the major idiocies in the writing of these episodes, but I won't. I have watched every episode because of the stuff I like about it. I hope the writers get their *hit together and give the fans a good ending. Seeing as how they are in the 5th season there may not be many more to come.
2.0~That Incessant Background "Music" ismailnuri Sign in Permalink I would like this if I could hear the characters with their whispering the dialogue. However, the crappy background din drowns out 90% of the dialogue. Hire some new sound engineers and fire the music guy! As for the story line, it has really gone haywire. The first season was promising but the direction it's taken since is from science future fiction to fantasy at it's worst. I have been a science fiction fan for years. Bring back the writers like Bradbury and Asimov, then at least we might be able to understand where the story line is going. I don't know half the time what is happening. It was a good premise carried out poorly.
3.0~a serious insult to intelligence ratatatuff Sign in Permalink The story is set after a nuclear apocalypse. Earth is radiated and the rest of humanity is living in a small space station and guess what... it's overpopulated and they run out of air. Some 100 TEENS (!) got sent to earth to check out if there is still radiation. This is dumb, seriously. Oh, I forgot, they are CRIMINAL teens, of course... because in the future they would have a government that sends teenagers into prison for minor crimes... oh yeah, sure... This follows the current trend of "lightweight" dystopia like "The Hunger Games" or "Elysium". That is, a "dystopia" stripped of any political, moral or ethical meaning but with a lot teen drama... Todays "dystopia" does not have anything in common with "Brave New World" or "1984", it has stooped to the level of "Beverly Hills 90210". The whole plot is ridiculous. The rest of humanity lives in a space-station and is sending CRIMINAL TEENAGERS out to die on a radiated earth? Really??? Humankind will only survive if it kills its children??? Somehow I really doubt that... And once these teenagers are down on earth they suddenly become aggressive idiots. Whoever wrote the story has a really strange vision of humanity. Or maybe this is a poor attempt at brainwashing the viewers to always obey law and order and never question authority (yes, sometimes I really had a feeling of watching right-wing propaganda, I kid you not)...but: even if there would be a space-station running out of air... even if they would send TEENAGERS down to earth... even if these teenagers would be incredibly dumb... ...they would certainly NOT behave like this! My suspension of disbelief was continuously broken by implausible and irrational actions by the characters. If you want to watch a bunch of pretty and really dumb teenagers doing a lot of dumb things while their parents get thrown out of the airlock, then you might like this series. If you want an intelligent sci-fi series you should stay far away from "The 100". I have seen a lot of bad shows but I think this is the one that tops everything. If I hadn't seen it I would not believe that someone really bought this script and decided to produce this crap. PS: I took a look at some of the 10Star-reviews (I could not believe that someone actually likes this AND rates it that high) and checked the names for their other reviews. Try it for yourself and see how many have been made by CW...
