6.0~Season one (3 out of 10) - Season 2 (8 out of 10) pjmf1975 Sign in Permalink This is my personal opinion. First Season ... I hated. Interesting story but that was it. I kinda agree with most of the I hated reviews!! Poor acting, silly dialogues, mediocre scripters easily like a bad cable movie. Second Season ... I love it, I cant wait for the next episode, and it's definitely on my Top 5, it's a completely new show, more credible, darker, interesting. I am truly impressed and definitely a fan. there are still space to improve, some lines and reactions are not credible enough, its not what normal people would in my opinion do or say in those circumstances but its getting there. Well done. I can see a bright future for this show.
3.0~juvenile subplot bbibikov Sign in Permalink The idea is original, the premise is great, but the plot is crappy because it is peppered with too many juvenile subplots; you know characters running around the forest constantly getting lost, getting saved, then lost again, then saved again, on and on it goes to no end. Do they ever learn to just stay and wait? The subplots takes away from the big picture, shifts our focus away from the main plot. What are some of these subplots? For example: constantly going back in time to learn why the character is who he is. Constant unnecessary misunderstanding, fighting, and love and hate relationships.When you focus on these things too much you are not informing watchers of what is going on in the main plot. Look, I understand this is science fiction, but in order for this science fiction to be good, it needs to be believable, and it is missing this ingredient because too many characters are miracles because they keep NOT DYING after getting way too many chances to die. They just don't die, it's like they were destined not to die, when in the real world they would be dead already. So stuff like that piles up and it drags the whole series to a big disappointment. Oh, and don't get me started on them getting bruised all the time and healing a day later. The amount of bruising they've all taken, they should have so many scars you would not recognize them by season 3.
10.0~AHH barkerchelsey Sign in Permalink Just found out there is more than 2 seasons LOL! I'm SO excited now!
10.0~Great Character Development nikolinadrum Sign in Permalink The character development is the best and strongest I have ever seen in a TV series for this target/age group. It's realistic, while in many other shows it feels like everything is really rushed... I can tell every actor/actress knows their character by heart and as a viewer it's easy to fall in love with their work and what they deliver on the TV screen. The writing and directing of each episode is well thought and the whole idea (and I would like to mention that I am very thankful for Kass Morgan's books) is very interesting to follow and after each episode I want to know what happens next, what new problems will arise and how life on earth changes. I am a huge fan and very grateful that I decided to give this show a go. Some quality content, I can tell. :)
5.0~Strictly for rabid fans of the sub-genre listval Sign in Permalink Poorly-written and acted (which is surprising because there are many good actors in it), but an interesting premise. If post-apocalyptic is your favorite sub-genre, you might like this. I watch it because I'll put up with a lot of bad writing and acting to watch an interesting post-apocalyptic premise develop. If you, for instance, watch a new episode of The Walking Dead, then watch Talking Dead, then go back and re-watch the TWD episode again immediately because you want to watch it again with the insights you gained from Talking Dead, this show might be for you. Otherwise, meh.
7.0~It's not good, but it's addicting: The cocaine of TV dramas jhuang523 Sign in Permalink Look, this show just isn't good. For starters, before even getting into the story, let's start with the effects; they look like they're out of a video game. Unrealistic. Then, the writing; although the premise is interesting, its realization was disappointing. There are too many plot holes and inaccuracies to count. Next, the acting is mediocre at best. How come the girls manage to keep their eyebrows waxed and legs shaved? Where are they getting make-up from? Why is the majority of the space station white, with people of color only sprinkled in the background to give the illusion of diversity! And then there's character development. They do a decent job of developing the guys' characters, making them complex, and, well, human. But I feel the females seem somewhat flat. They're used for sex scenes and dull, rushed relationships. Overall, though, they did seem to capture human nature relatively well with the Lord of the Flies-esque dynamic. The whole "plan- everything-neat-freak girl meets carefree-adventurous-charming guy and falls in love and changes" trope (hint, hint; Finn and Clarke) is SO overdone. Same goes for the love triangle. However bad this show may be, it's got me hooked. You really can't expect much from a TV drama from CW. I don't know what it is about this show, but I can't stop watching. (Actually, I'm probably only still here because of Finn). I can point out everything wrong with the show, but I just can't put my finger on what they're doing right. The bottom line is this: you can't go into this show with high expectations. You won't make it past the first 20 minutes of the pilot. Give it a try, though. I certainly didn't believe I would last this long.
5.0~Some interesting ideas but extremely cheap writing tricks make it unbearable. michaeloansalow Sign in Permalink This had promise to be interesting but it turned into "let's see how many times we can make characters do incredibly stupid things to create dramatic tension". If you like dark bad teen drama with some potential for decent sci-fi that it doesn't quite manage to reach then this is for you.
3.0~Season 3 is a disaster Sennara Sign in Permalink When I started watching the series it was getting better and better and the second season was superb. Then came the much anticipated season 3 and it unfortunately is a disappointing flop. There's no more reasonable plots going on. It's just full of cruel and stupid people in every camp of the story. Lots of stupid people now only keep setting up, killing, misleading, hating and hurting each other. And some of the very few adorable character such as Lincoln and Lexa were just wasted for no any meaningful reason. I can't even bear or have the patience to watch this crap any more. It's simply disastrous. I'm feeling very disappointed that such a used-to-be-good series spirals down so badly.
1.0~The 100 airs episode about massive shootings of innocent children/adults? Disgusting! nikkinak003 Sign in Permalink I recently watched the The 100 series on Netflix. I will say that at first I did like this show. On November 19th 2014 a new episode premiered on television. I was eager to watch the show and it ended so horribly I have been having night mares ever since. The end showed a great character loose his mind and start to kill a village of innocent people/children thinking his girlfriend was there. Its hard for me to understand. I did not know before watching the show that I would be watching children being gunned down. Then to top it off the girlfriend shows up and he is just standing there like, what did I do? Why didn't they just show they guy killing himself then? My goodness! Poor show. Come on now! At this delicate time with all the school shootings across the United States why would the writers @100writersroom make this come across as if this was just an easy thing to do? Great example The 100! (sarcasm)
10.0~one of my favorite TV-shows crico_italiano Sign in Permalink this show is amazing. all the acting is great! it's a great story and you will be hooked ! my favorite Alycia Debnam Carey is such a talent. as the story goes on you will love someone and hate someone and suddenly those you love you end up hating and those you hated you will love! you will go insane such fantastic characters, great storyline, and nice looking scenes. this show is going be a legend one! I like the way the story goes after the first 5 episodes ,they start off slow and then they hit you with a wave of elegance,mystery and performances that you will remember for ever. you never now what is going to happened,this show gets better and better. whatever choice the characters make, there will be consequences Awesome !!! I'm thrilled and can't wait for the next episode !!! thank you!
8.0~The 100, BigGringo Sign in Permalink Show is not that bad, pretty good actually. Not as fantastic as the Kartrashians, as I am sure many of the bad reviewers of this show prefer, but all in all it is pretty darn good. Seriously, in comparison to the other shows that are on TV or have been on TV in the past, this show rates pretty high in my book. It is a decent show in the mix of so many lame reality shows, that are not really reality but scripted pap... I would prefer to watch this over Kate plus x, Boogers, Kartrashians, Survivor, Idol any day, all day long. So yes it can be better I rank it a solid 8 in comparison to the other crap on TV
1.0~It had such potential! jowyzy Sign in Permalink I really enjoyed the first two seasons but the show went off the rails in season three and just never seemed to recover. I don't know if it's because certain writers left or exactly why it seemed to go off course. I enjoyed the concept of good intentioned people having to make impossible decisions to survive. It just seemed to turn into torture porn with characters making decisions that weren't in line with their development. They do have several talented actors and guest stars that made it watchable. However even that no longer was enough to hold my interest.
7.0~A Strong 7/10 jarl-lundstrom Sign in Permalink Only reason to why i wanted to check out this was because of Henry Ian Cusick who played Desmond Hume in LOST. I started to watch season 1 and thought that it was not so good at first. In my opinion it was a bit slow and there was not enough happening to catch my attention. But after i almost gave up at episode 4 or 5 it started to get better and better so i ended up watching it to the end of season 1. Season 2 gets better then season one so i will keep watching it. The acting is not so good but it is OK and if you got nothing else or better to watch then this is pretty good in my own opinion. Would recommend this to anyone who like apocalyptic events or futuristic stuff :)
1.0~Horrible isn't a strong enough word webbie3000 Sign in Permalink When A TV show has an awful Pilot, I tell myself that it doesn't necessarily mean the entire series is horrible. however in this case it does. Whats bad about this series? well lemmee tell you! -music: Apparently the people who chose the music thought the show would be made better by throwing tons of currently-popular-pop-music in the background. I have nothing against pop music. But when its being shoved down your throat like that, just to imply "hey we got this good song in here so that makes our TV show good too amiright?" then I don't enjoy it. -acting: I know that teenagers aren't always good actors, so I'd be willing to cut them a little slack in that regard. But none of them are good, and I mean none, you'd think at least the actors for the main characters would have a little more thought put into them casting- wise. "but here at the cw, all we care about is money!" Also all the conflict between them seems really forced, like they try to jump into some lord-of-the- flies type crap as soon as they get off the spaceship. -plot: The plot is stupid, which usually I can overlook. For example, "snowpiercer", a movie about a train that goes around the entire world. That's just plain dumb. But I accepted it for what it was and managed to enjoy the rest of the movie. but with this crap right here.....Don't even get me started on plot holes... Example: All the kids sent to earth have wristbands that send their vitals back to a space station. but when the kids start taking them off, since their is no signal going to the space-station, the Adults up there assume they're dead. so you're telling me you can design A fancy futuristic wristband that monitors vital signs....but can't determine the difference between taking it off, or the person just getting killed? that's just stupid right there. -pacing: It felt like originally each episode of this show was suppose to be twice as long, but at the last minuet they had to edit it down to 45 minuets. Everybody is constantly spewing exposition in your face. And when they aren't spewing exposition.....they're talking.....and talking....You need some gosh darn silence every once in a while, but apparently ain't nobody got time fo' dat'
3.0~Why my rating has dropped from an 8 to a 3 jabel-93009 Sign in Permalink I want to start out by saying that I used to really enjoy this show. It was just plain cool- I loved the premise that a bunch of people who have lived through nuclear Armageddon by going to space, return to earth, and find that there's people who have survived and have a new culture all their own. Language, towns, rites and rituals- all fascinating. In season five, it was decided to do a do-over, having killed off almost everyone, by having yet another nuclear storm that I guess was world wide. A new group from space lands, and total chaos erupts. A lot of very positive reviews are being posted. But, count me out. I'm finding the new season tedious, dark- literally too- I often can't see what's going on, and so hopeless.
6.0~Full of Potential but Suffering from Identity Crisis poetictank Sign in Permalink Firstly, I was hesitant in picking up this show after reading the reviews and seeing some trailers on the internet.It took me several weeks to hurdle past the first 4 or 5 episodes, but then I was hooked. Season 1 had some truly great character developments and left you wondering, "What next?". The story line was fairly predictable from the beginning, but some of the betrayals and plots had significant enough twists that kept you questioning the sky people's next move. In Season 2, a lot of the surviving characters, both main and secondary presences, felt dragged along and more of an annoyance than an actual pinpoint for the show. At times, I've felt that the writers took away and added characters simply to fill-in gaps and it tended to lead towards sloppier writing. However, I did appreciate some unexpected betrayals and the well-written main plot of the show that led the sky people to their final achievement at the end of the season. Thirdly, Season 3 feels very loose and unpolished. It feels like the character development is dry and that all of the great twists, plots and changes in the show were bled dry towards the mid-end of Seasons 1 and 2. All-in-all, the show has potential but doesn't feel like the either the producers/writers/directors are in sync in terms of what the show's identity truly is. Actually, that's a perfect way to describe the lacking parks of this show: an identity crisis. Some actors seem to have adopted different styles of portraying their roles, some more convincing and easier to watch than others. Sometimes, the show feels like it's being maturely written on par with a show by the likes of Game of Thrones, Vikings or Breaking Bad, but then suffers from a case of still wanting to be a teenager with cringe-worthy scenes and character developments. I truly believe that this show could've been a one of a kind if it just decided to steer far away from some of the casting that's more pleasing to the eyes than the heart and some of cheesiest writing that you'll witness in a while.
7.0~Pretty cool concept michaelcook-43025 Sign in Permalink Although the first few episodes were cheesy, the concept intrigued me enough to continue watching. It did get better, but there are so many things about the show that just don't make sense. They send a group of 'criminals' down to Earth to see if it's inhabitable, but just let 300 people die on the ark in order to save resources - why not just send those people down too; at least they would have a chance for survival. They use terms that, over the course of 100 years, would probably not be used so much; in particular, they use the word "hanged" when referencing the attempted hanging of one of their own instead of "floated," which is the term they use every other time they talk about killing somebody. The moment the group lands on Earth, they realize they are 20 miles from the place they should be, and make it the whole way and back in a day...um, this is their first day EVER on Earth...they have never walked in nature before, and there is no way their lungs/bodies could hold up to 40 miles of walking in a day...or even a week. The acting started out awful, but has continuously gotten better through each episode. Special effects are decent for a TV show. In episode one, mention is made to several other arks...it would be interesting to see these arks join in on the show...one last thing; the "grounders" have survived for 100 years after nuclear war...it seems unlikely that they would be 'savages' or idiots who never tried to communicate with the ark. Yes, this is a pretty bad review, but somehow, the concept of the show intrigues me enough to say it's better than average!
10.0~Awesome show! xenimuspowerup Sign in Permalink In my opinion this show is alot better and alot more realistic than game of thrones. Definately worth watching 10/10!
1.0~Way too much drama. eveolinerules222 Sign in Permalink I have seen shows add in extra unnecessary drama to make it seem more appealing and to make the show last but, just, wow. This show takes the cake on unnecessary drama awards. From start to finish just constant little drama scenes for no reason. Stuff that could easily have been avoided or has nothing to do with the plot other then just adding in drama happens ever few mins, its ridiculous. Not only that, they send a bunch of teen kids who seem to be the only prisoners anymore to a plant without any training or warning and let them do whatever they like. I do however like the concept of the show of all humans dieing out and the ship coming back to repopulate it. Just the implementation of it turns it into a teen drama for no reason what so ever.
10.0~best show giuliageus Sign in Permalink I've read a lot of negative and positive reviews, a lot of people mentioned holes, which a lot of them are answered in the show! just watch it first, then write a review! this is one of the best shows to come out, i watched the first season in one day! i was hooked! don't judge it by the first episode, you got to give it time for the story to unfold. i look forward to Wednesday so i can watch a new episode, i think this show is great, its got a bit of everything, action,romance, attractive characters, and a good storyline, i do think that end of season 1 and season 2 is the best, but overall this show is great give it a chance! 10/10
6.0~Narcissistic, selfish, calculative and unlikable main characters user-895-587379 Sign in Permalink The show really is brainless in the sense that the characters exhibit all the negative teenager traits. I actually was starting to enjoy the show but as the episodes kept coming and characters kept developing I begun to realize that none of them were likable. For me this ruins the show since it's all about the characters and politics. The least likable for me is the main character Clarke, every time she opens her mouth I just want to cringe. A narcissistic selfish calculative character, yet they try to sell her as a leader and hero. I think the concept of the show is good, but the me against the world selfish narcissistic characters they develop are stress inducing to watch.
3.0~Written by a 10-year-old? johntwatterson Sign in Permalink Written by a 10-year-old?How anyone survived a nuclear Armageddon on the show boggles the mind of anybody with a double digit in IQ. Every single person in the show displays nothing but savagery stupidity and speciesism. You can count on every episode for at least one of the characters mostly more than one to make a stupid decision one that affects everybody. In an actual situation most of these people wouldn't even have the proper Position to make most of the decisions that are made in this ridiculous series. It's my view that it's a total failure, but it is watchable if you like to watch Bruce Willis films, which are equally stupid.
5.0~Great start but continue decrease - from season to season mail-92229 Sign in Permalink For seasons 1&2 my rating would have been (at least a) 9! But thereafter storyline, behavior of characters... started to change and not in a favorable manner Season 5 was overall a disappointment (at max good for 2 stars). Thus 5/10 is a quite kind average
2.0~Some very good questions jessicafiddler-76-140269 Sign in Permalink It's really unfortunate and was apparent even after a few minutes of watching that they just didn't put in enough time introducing the situation and characters. We can't feel for people we don't know or care about an earth that no one knows anything about. Aside from the writing and acting being just too fast so far, this show does offer a teenager friendly alternative to the apocalyptic "Walking Dead" kind of entertainment we see on TV lately. Human race being wiped out, earth in jeopardy, etc. The real problem I have with this is that it's cheap. They are relying on a few CGI tricks to keep people's attention away from bad development. Who taught the second generation engineering, physics, construction, medicine and every branch of these fields? How much of people's days are spent trying to keep an aging space station up to speed? How did they keep plates, spoons, forks, shoes, cloth, plastic, and every piece of glass for 100 years? Do they have iron smelts? Do they have any raw materials? What fuel do they burn? I don't know about you guys but I need to buy new underwear at least every 6 months. Where are the sheep? The cotton plants? the cows? How did they keep sewing machines operational without manufacturing replacement parts? What about agriculture? It takes approximately 1 acre to feed one person. An acre is the size of a soccer field. 4,000 acres? and how have they maintained the quality of the soil with the depletion of nutrients? Like I said, this is just cheap. I took a few minutes with Google to come up with so many problems this show has. There are just too many better shows going right now. But if the time slot doesn't coincide with something better, I can see teenagers watching it. For me, I'd rather watch random Youtube vids or listen to a pod cast.
4.0~All production no personality or plot egwardo84 Sign in Permalink This had potential, but sloppy writing and poor acting results in standard American teen dross! The first episode suggests that after 97 years in space they send 100 people down to earth to see if it is safe because there are only 4 months of resources left in space. If they haven't come up with any other options than return to earth in the 97 years they have to think about it, what other options do they think they are going to find in 4 months, so why wouldn't they take the whole spaceship back to earth? They haven't got any other options! Not to mention the fact that it would probably take months to get the thousands of people to re-enter the atmosphere safely. Setting that aside they send 100, what they consider criminals to Earth and don't seems to have considered the possibility that they may go AWOL. I have only seen 1 episode and I could go on, but what's the point, the series ain't worth in more ways than one.
8.0~Low-budget but awesome mroq Sign in Permalink When I first saw this production, I said immediately that it is something like "Twilight" but with time came that I was wrong. It turned out that this is one of the best post apocalyptic series. The story itself attracts the viewer and makes it hard to walk away from the TV. The advantage of this production are characteristically heroes. The main character of the show is a teenage Clarke who has many faces, from episode to episode we get to know it from the other side, but despite that she is a main character, it remains in the shadow of secondary characters. Bellamy, Octavia, Jasper, Kane, Raven and Monty - the actors who played them managed to create such a colorful and distinctive characters, that for a long time after watching, has to be kept in mind. Each of them gradually develops and makes never be too many of them on the screen. In addition, the show has a lot of great actors who have appeared only episodically and still managed to grab the viewer's heart e.g Alycia Debnam-Carey, who despite the fact that she looks like a sweet girl - plays one of the toughest women in the show. Another advantage are the obstacles in the way of heroes. They have to deal with the Grounders, fiercely defending their territory, mutated animals and psychopaths who want everything for themselves. In the world of "The 100" practically everything that moves, it is deadly and that is just beautiful. The series has one, but very visible, and for some people, annoying minus - special effects. Through them, you will see how low the budget is this series. Summarizing. "The 100" proved to be one of the best science fiction series in recent years. The creators have already announced the next season and I hope that the show will maintain its own climate, because it is awesome. Sorry for my bad English D: doing my best :)
